{"created_at":"1970-01-01T00:00:00Z","schema_id":"ShotList","schema_version":"1.0.0","script_id":"script-phase0-demo-example","shotlist_id":"shotlist-phase0-demo-example","shots":[{"audio_intent":{"music_mood":null,"sfx_tags":[],"vo_speaker_id":"commander","vo_text":"We have lost contact with the probe."},"camera_framing":"wide","camera_movement":"STATIC","characters":[{"character_id":"commander","expression":null,"pose":null}],"duration_sec":5.6,"scene_id":"scene-001","shot_id":"scene-001-shot-001"},{"audio_intent":{"music_mood":null,"sfx_tags":[],"vo_speaker_id":"commander","vo_text":"We have lost contact with the probe."},"camera_framing":"medium_close_up","camera_movement":"STATIC","characters":[{"character_id":"commander","expression":null,"pose":null}],"duration_sec":5.6,"scene_id":"scene-001","shot_id":"scene-001-shot-002"},{"audio_intent":{"music_mood":null,"sfx_tags":[],"vo_speaker_id":"commander","vo_text":"Prepare for immediate launch."},"camera_framing":"wide","camera_movement":"STATIC","characters":[{"character_id":"commander","expression":null,"pose":null}],"duration_sec":3.0,"scene_id":"scene-002","shot_id":"scene-002-shot-001"},{"audio_intent":{"music_mood":null,"sfx_tags":[],"vo_speaker_id":"commander","vo_text":"Prepare for immediate launch."},"camera_framing":"medium_close_up","camera_movement":"STATIC","characters":[{"character_id":"commander","expression":null,"pose":null}],"duration_sec":3.0,"scene_id":"scene-002","shot_id":"scene-002-shot-002"}],"timing_lock_hash":"aaaaaaaaaaaaaaaaaaaaaaaaaaaaaaaaaaaaaaaaaaaaaaaaaaaaaaaaaaaaaaaa","total_duration_sec":17.2}
